rank,mutation,position,aa_from,aa_to,category,esm_score,ddg_foldx,prediction_basis,mutagenesis_primers,protocol_notes,rationale
1,M276L,276,M,L,Priority-A,-1.73,0.52,Aliphatic substitution at the M276 hit site. Leucine provides optimal hydrophobic packing compared to the wild-type methionine.,Forward: 5'-GGTGGAGCTGAAGTGTTGGCAGATAGTAGTTTTG-3',Standard protocol applies,Round 1 showed M276R as a hit; aliphatic scan at this position is required to find the optimal hydrophobic fit.
2,V176F,176,V,F,Priority-B,-2.6,0.78,Compact aromatic substitution. Phenylalanine may fit where the larger Tryptophan (W) failed in Round 1.,Forward: 5'-GCTGTTACTTTTGATCAAAGAACTGG-3',Standard protocol applies,V176W was reduced but not dead; F is smaller and may be better accommodated.
3,E306S,306,E,S,Priority-C,-2.31,0.69,Polar uncharged substitution. Serine is small and likely to be tolerated at this flexible position.,Forward: 5'-GGTAGAGTAGATCCAAAAGGTATTAAATTTG-3',Standard protocol applies,E306 variants showed partial activity in Round 1; S is a novel polar uncharged candidate.
4,E306T,306,E,T,Priority-C,-2.71,0.81,"Threonine provides a polar side chain with slightly more bulk than serine, testing the tolerance of E306.",Forward: 5'-GGTAGAGTAGATCCAAAAGGTATTAAATTTG-3',Standard protocol applies,E306 is a known tolerance zone for charge/polarity changes.
5,G210S,210,G,S,exploratory,-3.85,1.42,Serine is the smallest hydroxyl-bearing residue; may be uniquely tolerated at G210 where all other substitutions (V/T/L/A) abolish activity.,Forward: 5'-GCTGGTAGAGTAGATCCAAAAGGTATTGCATTTG-3',Standard protocol applies,G210V/T/L/A all dead in Round 1 — G210S is the sole untested substitution with a plausible tolerance argument based on minimal sidechain volume.
